<?xml version="1.0" encoding="utf-8"?>
<xsd:schema xmlns:xsd="http://www.w3.org/2001/XMLSchema">
  <xsd:element name="root">
    <xsd:complexType>
      <xsd:sequence>
        <xsd:element name="script" minOccurs="0" maxOccurs="unbounded">
          <xsd:complexType>
            <xsd:attribute name="language" type="xsd:string" use="required" />
            <xsd:attribute name="file" type="xsd:string" use="required" />
          </xsd:complexType>
        </xsd:element>
        <xsd:element name="data_type" minOccurs="0" maxOccurs="unbounded">
          <xsd:complexType>
            <xsd:attribute name="name" type="xsd:string" use="required" />
            <xsd:attribute name="values_count" type="xsd:integer" use="required" />
            <xsd:attribute name="base_type" type="BaseTypes" use="optional" />
          </xsd:complexType>
        </xsd:element>
        <xsd:element name="semantic" minOccurs="0" maxOccurs="unbounded">
          <xsd:complexType>
            <xsd:attribute name="name" type="xsd:string" use="required" />
            <xsd:attribute name="data_type" type="xsd:string" use="required" />
            <xsd:attribute name="function" type="xsd:string" use="optional" />
          </xsd:complexType>
        </xsd:element>
      </xsd:sequence>
    </xsd:complexType>
  </xsd:element>
  <xsd:simpleType name="BaseTypes">
    <xsd:restriction base="xsd:string">
      <xsd:enumeration value="FLOAT" />
      <xsd:enumeration value="INTEGER" />
      <xsd:enumeration value="BOOLEAN" />
    </xsd:restriction>
  </xsd:simpleType>
</xsd:schema>